,Hotel Name,Province,Postal,Category,SubCategory,Compound Sentiment,Review Summary,Total Reviews,Popular Keywords,Average Rating
0,1906 Lodge At Coronado Beach,CA,92118,"Resorts & Vacation Cottages,Hotels and motels,Hotel and motel reservations,Resorts,Hotels Motels,Accommodations & Lodging,Hotels & Motels,Hotel",Accommodation & Food Services,0.95,"[""Can't wait to return!""]",1,"[('ca', 0.5773502691896258), ('return', 0.5773502691896258), ('wait', 0.5773502691896258)]",5.0
1,250 Main Hotel,ME,4841,"Hotels and motels,Hotel and motel reservations,Hotels,Motels,Lodging,Hotel",Accommodation & Food Services,0.9726,"['250 Main Is Superlative', ' Diamond']",2,"[('diamond', 1.0), ('250', 0.5773502691896257), ('main', 0.5773502691896257), ('superlative', 0.5773502691896257)]",5.0
2,AC Hotel Chicago Downtown,IL,60611,"Hotels,Hotel",Accommodation & Food Services,0.9966,"['We had a wonderful time and would recommend this hotel.', ' The location was great and the room was very modern. Love the flooring.', ' Excellent location and good price for money.', ' Wonderful stay!']",11,"[('location', 2.2530332883542146), ('hotel', 1.5192317567958156), ('wonderful', 1.1289312137623746), ('good', 1.0008823358964214), ('stay', 0.7601495451333123)]",4.08
3,AC Hotel Miami Beach,FL,33140,"Hotels,Hotel",Accommodation & Food Services,0.9814,['Excelent stay and courteous staff at the AC Hotel Miami'],1,"[('ac', 0.3779644730092272), ('courteous', 0.3779644730092272), ('excelent', 0.3779644730092272), ('hotel', 0.3779644730092272), ('miami', 0.3779644730092272)]",5.0
4,AC Hotel by Marriott Boston Downtown,MA,2118,"Hotels,Hotel",Accommodation & Food Services,0.4007,['Excellent stay. Hope to stay there again.'],1,"[('stay', 0.8164965809277261), ('excellent', 0.4082482904638631), ('hope', 0.4082482904638631)]",5.0
5,ARIA Resort Casino,NV,89158,"Hotels,Casinos,Resorts,Resort,Casino,Hotel",Accommodation & Food Services,1.0,"[' Best value for nicest room', ' Very good friendly, courteous and knowledgeable staff(s)', ' Excellent Choice for Relaxation', ' Wonderful rooms with lots of space. Nice pools and a good choice of restaurants.']",139,"[('hotel', 13.83802798289139), ('great', 10.582360665234132), ('aria', 7.475677793558088), ('stay', 6.1316937424840185), ('nice', 5.994811666232993)]",4.5
6,Acadia Suites,ME,4609,"Hotels,Lodging,Motels,Hotels Motels,Hotel",Accommodation & Food Services,0.9668,"['A great spot', ' A Place to Go Back To']",2,"[('place', 1.0), ('great', 0.7071067811865476), ('spot', 0.7071067811865476)]",5.0
7,Ace Hotel Chicago,IL,60611,"Hotels,Hotel",Accommodation & Food Services,0.9459,"['Overall very pleasant stay.', ' The staff was really friendly and the free coffee was good.', ' Bed and shower were awesome', ' Nice hotel, but they do not let you know that valet is 30. They just bill you for it']",4,"[('awesome', 0.5773502691896257), ('bed', 0.5773502691896257), ('overall', 0.5773502691896257), ('pleasant', 0.5773502691896257), ('shower', 0.5773502691896257)]",4.65
8,Ace Hotel New Orleans,LA,70130-3511,"Hotels,Hotels and motels,Hotel Central Business District,Hotel",Accommodation & Food Services,0.9885,"['Disappointing', ' Great experience', ' Watch out for the concrete column in room 601!']",3,"[('disappointing', 1.0), ('experience', 0.7071067811865476), ('great', 0.7071067811865476), ('601', 0.4472135954999579), ('column', 0.4472135954999579)]",3.33
9,Admiral Hotel,TX,76006,"Hotels and motels,Hotel North Arlington,Hotel",Accommodation & Food Services,-0.296,['three night stay'],1,"[('night', 0.7071067811865475), ('stay', 0.7071067811865475)]",2.0
10,Admiral's Ocean Inn,ME,4915,"Hotels,Lodging,Hotels and motels,Hotel and motel reservations,Hotels Motels,Hotels & Motels",Accommodation & Food Services,0.34,"['Do not stay here', "" Yup - only if you're desperate!""]",2,"[('stay', 1.0), ('desperate', 0.7071067811865476), ('yup', 0.7071067811865476)]",1.0
11,Alakai Hotel & Suites,WI,53965,"Hotels and motels,Hotels,Lodging,Motels,Hotel",Accommodation & Food Services,0.704,"['Very clean, but outdated']",1,"[('clean', 0.7071067811865475), ('outdated', 0.7071067811865475)]",5.0
12,Alamo Motel,CA,93440,"Hotels and motels,Hotel and motel reservations,Motel,Hotels Motels,Hotel",Accommodation & Food Services,0.4934,['Cute but meh'],1,"[('cute', 0.7071067811865475), ('meh', 0.7071067811865475)]",3.0
13,Algoma Beach Motel,WI,54201,"Hotels,Lodging,Motels,Corporate Lodging,Resorts,Hotel,Family-friendly Hotels,Business Hotels,Hotels Motels,Boutique Hotels",Accommodation & Food Services,0.9811,['Great place.'],1,"[('great', 0.7071067811865475), ('place', 0.7071067811865475)]",4.0
14,Alicia's Eagle Rock Lodge,AK,99611,"Hotels,Lodging,Motels,Hotels Motels,Travel and Tourism,Hotel",Accommodation & Food Services,0.3818,"['Room was fine, but VERY small...']",1,"[('fine', 0.5773502691896258), ('room', 0.5773502691896258), ('small', 0.5773502691896258)]",3.0
15,Aloft Arundel Mills,MD,21076,"Hotels,Hotels and motels,Travel agencies and bureaus,Hotel and Motel Management,Hotel & Motel Management,Motels,Hotel",Accommodation & Food Services,0.995,"[' ALWAYS GREAT STAY...', ' Wonderful stay', ' Worth the money', ' Great Hotel Experiece!']",6,"[('stay', 1.6539962353441586), ('great', 1.265709109942219), ('wonderful', 0.8221903715494888), ('money', 0.7071067811865476), ('worth', 0.7071067811865476)]",4.5
16,Aloft Bolingbrook,IL,60440,"Hotels,Hotels and motels,Travel agencies and bureaus,Lodging,Hotel",Accommodation & Food Services,0.1154,['Great Ambiance'],1,"[('ambiance', 0.7071067811865475), ('great', 0.7071067811865475)]",5.0
17,Aloft Buffalo Airport,NY,14225,"Airports,Hotels and motels,Hotel and motel reservations,Hotel,Hotels,Lodging,Travel and Tourism",Accommodation & Food Services,0.9958,"['Overnight Stay', ' Weekend Shopping Trip!', ' Clean hotel with friendly service', ' Great atmosphere']",5,"[('atmosphere', 0.7071067811865475), ('great', 0.7071067811865475), ('overnight', 0.7071067811865475), ('stay', 0.7071067811865475), ('blah', 0.5773502691896258)]",4.4
18,Aloft Cleveland Downtown,OH,44113,"Hotels,Hotels and motels,Lodging,Real estate,Hotel",Accommodation & Food Services,0.9808,"['Great Location at Foot of the Flats in Cleveland', ' A Hip addition to Cleveland Downtown waterfront!', ' Great stay location!']",3,"[('great', 0.9113673202616698), ('location', 0.9113673202616698), ('cleveland', 0.7489436719443898), ('stay', 0.680918560398684), ('flats', 0.5174199439321682)]",4.33
19,Aloft Denver Downtown,CO,80202,"Hotels,Lodging,Hotels and motels,Hotel,Hotel Central Business District",Accommodation & Food Services,0.9123,"[""Clean, Walking distance for all convention goers' needs""]",1,"[('clean', 0.4082482904638631), ('convention', 0.4082482904638631), ('distance', 0.4082482904638631), ('goers', 0.4082482904638631), ('needs', 0.4082482904638631)]",5.0
20,Aloft Detroit at The David Whitney,MI,48226,"Hotel,Hotels and motels,Hotels,Lodging",Accommodation & Food Services,0.9811,"['Great for Business or Pleasure', ' Pleasantly Surprised']",2,"[('pleasantly', 0.7071067811865476), ('surprised', 0.7071067811865476), ('business', 0.5773502691896257), ('great', 0.5773502691896257), ('pleasure', 0.5773502691896257)]",4.0
21,Aloft Durham Downtown,NC,27701,"Hotels,Hotels and motels,Travel and Tourism,Lodging,Motels,Hotel Bull Durham,Hotel",Accommodation & Food Services,0.9518,"['Hotel next to DPAC', ' Great stay / good value at new Aloft property.']",2,"[('dpac', 0.7071067811865476), ('hotel', 0.7071067811865476), ('aloft', 0.3779644730092272), ('good', 0.3779644730092272), ('great', 0.3779644730092272)]",4.5
22,Aloft Greenville Downtown,SC,29601,"Hotels,Hotels and motels,Hotel Downtown Greenville,Lodging,Hotel",Accommodation & Food Services,0.6865,['Eclectic Charm Outstanding Quality and service'],1,"[('charm', 0.4472135954999579), ('eclectic', 0.4472135954999579), ('outstanding', 0.4472135954999579), ('quality', 0.4472135954999579), ('service', 0.4472135954999579)]",5.0
23,Aloft Houston by the Galleria,TX,77056,"Hotel,Hotels and motels,Hotel and motel reservations,Hotels,Hotels Motels,Family-friendly Hotels,Tourist Hotels,Weekend Getaway Hotels,Luxury Hotels,Resorts,Ski Resorts,Boutique Hotels,Lodging,Business Hotels,Hotels & Motels,Hotel Uptown-Galleria",Accommodation & Food Services,0.8288,['Urban...minimalist....'],1,"[('minimalist', 0.7071067811865475), ('urban', 0.7071067811865475)]",4.0
24,Aloft Jacksonville Tapestry Park,FL,32246,"Hotels,Bar,Hotels and motels,Hotel Bar,Lodging,Cocktail Bar,Hotel",Accommodation & Food Services,0.9989,"['Great hotel, great location and GREAT staff', ' Love Couple', ' Great Location, Slow Food Service', ' Love it!']",5,"[('love', 1.6279137616509933), ('great', 1.2187244821773517), ('couple', 0.7782829228046183), ('february', 0.7071067811865475), ('stay', 0.7071067811865475)]",4.8
25,Aloft New Orleans Downtown,LA,70112-1701,"Hotels,Lodging,Motels,Hotel",Accommodation & Food Services,1.0,"[' Great Stay!!!!', ' Outstanding and friendly facility', ' neat, clean and well organized', ' Well priced, good location, spacious rooms, good onsite breakfast']",39,"[('hotel', 4.908207727401805), ('nice', 4.52717345018446), ('stay', 4.445998191518822), ('great', 3.816045641385272), ('good', 2.4313356486646445)]",4.23
26,Aloft Philadelphia Downtown,PA,19107-6523,"Hotels,Hotels and motels,Bar and grill restaurants,Hotel and Motel Consultants,Lodging,Hotel",Accommodation & Food Services,1.0,"[' Great hotel and location', ' Great stay for a quick business trip!', ' Best Staff Ever', ' Cooler than custard!! I love it!']",16,"[('hotel', 1.631901714067082), ('stay', 1.3852070180605551), ('great', 1.3253285048656156), ('staff', 1.3134808383000196), ('location', 1.276755363779193)]",5.0
27,Aloft Sarasota,FL,34236,"Hotel,Hotels and motels,Hotels,Lodging",Accommodation & Food Services,0.9882,"['Great getaway', ' Downtown highrise - close to the action']",2,"[('getaway', 0.7071067811865476), ('great', 0.7071067811865476), ('action', 0.5), ('close', 0.5), ('downtown', 0.5)]",5.0
28,Alpine Inn,IL,61108,"Hotels and motels,Hotel and Resort,Hotel",Accommodation & Food Services,0.9731,"['Alpine Inn', ' Affordable', ' pit stop to the water park']",3,"[('affordable', 1.0), ('alpine', 0.7071067811865476), ('inn', 0.7071067811865476), ('park', 0.5), ('pit', 0.5)]",4.0
29,Alpine Motel,VA,24210,"Hotels,Hotels and motels,Travel and Tourism,Lodging,Motels,Hotel",Accommodation & Food Services,0.9908,"['Nice big rooms and clean', ' Quaint Motel On The Edge of Town', ' Great value, beautiful view, bed was average.']",3,"[('big', 0.5), ('clean', 0.5), ('edge', 0.5), ('motel', 0.5), ('nice', 0.5)]",3.67
30,Alpine River Suites,GA,30545,"Hotels,Lodging,Hotel",Accommodation & Food Services,0.9657,['Awesome'],1,"[('awesome', 1.0)]",5.0
31,Ambassador Hotel,WI,53233,"Hotel,Banquet facilities,Hotels and motels,Hotels Motels,Family-friendly Hotels,Tourist Hotels,Travel,Business Hotels,Budget Hotels,Hotels & Motels",Accommodation & Food Services,0.986,"[""Looks nice but it's in the hood"", ' Disorganized and NOT a 4 star property', ' Lovley Place to Stay', ' Dried vomit on bed skirt']",5,"[('disorganized', 0.5773502691896258), ('hood', 0.5773502691896258), ('looks', 0.5773502691896258), ('lovley', 0.5773502691896258), ('nice', 0.5773502691896258)]",2.8
32,"Ambassador Hotel Oklahoma City, Autograph Collection",OK,73103,"Hotels,Hotels and motels,Hotel,Hotel and Resort",Accommodation & Food Services,0.9985,"['Very nice hotel - exceptional service and cool bar', ' Best place in OKC', ' Great time', ' Best in class and the only place I stay in OKC...']",6,"[('best', 0.9864751551875919), ('okc', 0.9864751551875919), ('place', 0.9864751551875919), ('hotel', 0.8381684398852807), ('nice', 0.8381684398852807)]",4.17
33,America's Best Inn Suites,GA,30093,"Hotels and motels,Hotel",Accommodation & Food Services,-0.9622,"[""America's Worst""]",1,"[('america', 0.7071067811865475), ('worst', 0.7071067811865475)]",1.0
34,America's Best Value Inn,KS,67401,"Hotels,Lodging,Motels,Hotel",Accommodation & Food Services,-0.854,['terrible place to stay!! cheap nasty dive!!'],1,"[('cheap', 0.4082482904638631), ('dive', 0.4082482904638631), ('nasty', 0.4082482904638631), ('place', 0.4082482904638631), ('stay', 0.4082482904638631)]",1.0
35,America's Best Value Inn,PA,15301,"Hotels,Hotels and motels,Lodging,Motels,Hotel",Accommodation & Food Services,-0.8775,"['Never Again', ' Worst Hotel I have ever experienced', "" America's Worst Value Inn"", ' worth the price']",4,"[('worst', 0.9012230152394123), ('price', 0.7071067811865476), ('worth', 0.7071067811865476), ('experienced', 0.6176143709756019), ('hotel', 0.6176143709756019)]",2.25
36,America's Best Value Inn Suites,TN,38474,"Hotels,Motels,Lodging,Hotel",Accommodation & Food Services,0.8126,['Bring Your Own Food'],1,"[('bring', 0.7071067811865475), ('food', 0.7071067811865475)]",3.0
37,American Inn,NV,89801,"Hotels,Bed and Breakfast and Inns,Hotel and motel consultants,Hotels and motels,Lodging,Hotels Motels,Motels,Hotel",Accommodation & Food Services,0.6808,['Nice'],1,"[('nice', 1.0)]",4.0
38,Americana Hotel,VA,22202,"Hotel,Hotels and motels",Accommodation & Food Services,0.9976,"['Good Motel Good Price!', ' Older property but a great deal close to Crystal City', "" Lovely Motel with original 50's style"", ' Scruffy But Clean']",6,"[('good', 0.8397416099143573), ('property', 0.8190661496747267), ('motel', 0.7236590130872703), ('clean', 0.7071067811865476), ('scruffy', 0.7071067811865476)]",3.67
39,Americas Best Value Inn,CT,6455,"Lodging,Motels,Hotels,Hotel",Accommodation & Food Services,0.9134,['Family Wedding'],1,"[('family', 0.7071067811865475), ('wedding', 0.7071067811865475)]",5.0
40,Americas Best Value Inn,IN,46637-3313,"Travel and Tourism,Hotels,Lodging,Hotel,Motels",Accommodation & Food Services,0.9963,"['Great service!', ' Friendly Host', ' Nice place at the right price']",3,"[('friendly', 0.7071067811865476), ('great', 0.7071067811865476), ('host', 0.7071067811865476), ('service', 0.7071067811865476), ('nice', 0.5)]",4.33
41,Americas Best Value Inn,KY,42503,"Hotels,Motels,Hotel",Accommodation & Food Services,-0.9018,"['Price was the only thing good', ' Bad bad']",2,"[('bad', 1.0), ('good', 0.5773502691896257), ('price', 0.5773502691896257), ('thing', 0.5773502691896257)]",1.0
42,Americas Best Value Inn,ME,4210,"Hotels,Lodging,Motels,Hotels and motels,Hotel and motel reservations,Hotels Motels,Hotel",Accommodation & Food Services,0.9883,"['Great service!', ' Worst customer service from front desk', ' disgusting', "" Don't judge a book......""]",4,"[('service', 1.0334190476558869), ('disgusting', 1.0), ('great', 0.7852882757103967), ('book', 0.7071067811865476), ('judge', 0.7071067811865476)]",2.75
43,Americas Best Value Inn,MI,49938,"Hotels,Lodging,Motels,Hotels and motels,Hotel and motel reservations",Accommodation & Food Services,0.9712,"['Dog Friendly Haven', ' On highway 2', ' Most uncomfortable beds ever']",3,"[('highway', 1.0), ('beds', 0.7071067811865476), ('dog', 0.7071067811865476), ('friendly', 0.7071067811865476), ('uncomfortable', 0.7071067811865476)]",4.0
44,Americas Best Value Inn & Suites Canon City,CO,81212,"Hotels,Hotels and motels,Hotel and motel reservations,Lodging,Motels,Hotel",Accommodation & Food Services,0.9511,"['Nice little hotel.', ' one night stay']",2,"[('night', 0.7071067811865476), ('stay', 0.7071067811865476), ('hotel', 0.5773502691896257), ('little', 0.5773502691896257), ('nice', 0.5773502691896257)]",4.0
45,Americas Best Value Inn & Suites-eureka,CA,95501,"Hotels,Hotels and motels,Hotel and motel reservations,Lodging,Motels,Hotel",Accommodation & Food Services,0.9757,['Great stay'],1,"[('great', 0.7071067811865475), ('stay', 0.7071067811865475)]",5.0
46,Americas Best Value Inn - Charlotte,MI,48813,"Hotels,Lodging,Motels,Hotels and motels,Hotel and motel reservations",Accommodation & Food Services,0.9413,"['this is a no frills efficient motel', ' Good for Price.', ' Would stay again']",3,"[('stay', 1.0), ('good', 0.7071067811865476), ('price', 0.7071067811865476), ('efficient', 0.5773502691896257), ('frills', 0.5773502691896257)]",3.67
47,Americas Best Value Inn - Corpus Christi/Port Aransas,TX,78373,"Hotels,Lodging,Motels,Hotel",Accommodation & Food Services,0.807,['Great Value and Convenient Location'],1,"[('convenient', 0.5), ('great', 0.5), ('location', 0.5), ('value', 0.5)]",4.0
48,Americas Best Value Inn - Executive Suite Airport,AK,99517,"Hotel,Hotels",Accommodation & Food Services,0.995,"[' Would stay here again', ' More than hoped for', ' A 2 star older hotel can still be clean', ' Large comfortable room for a budget price.']",10,"[('accomodating', 1.0), ('hoped', 1.0), ('painful', 1.0), ('stay', 1.0), ('hotel', 0.9557868079913806)]",2.6
49,Americas Best Value Inn - Greeley/Evans,CO,80620,"Hotels,Lodging,Motels,Hotel",Accommodation & Food Services,0.3384,['Excellent place to stay...if you are desperate!'],1,"[('desperate', 0.5), ('excellent', 0.5), ('place', 0.5), ('stay', 0.5)]",1.0
50,Americas Best Value Inn - Medical Center / Lubbock,TX,79410,"Hotels,Lodging,Motels,Hotel",Accommodation & Food Services,-0.8436,['Very dirty! Avoid at all cost!'],1,"[('avoid', 0.5773502691896258), ('cost', 0.5773502691896258), ('dirty', 0.5773502691896258)]",1.0
51,Americas Best Value Inn Albert Lea,MN,56007,"Hotels,Motel,Lodging,Motels,Hotel",Accommodation & Food Services,0.5267,['Last resort Hotel'],1,"[('hotel', 0.7071067811865475), ('resort', 0.7071067811865475)]",3.0
52,Americas Best Value Inn Bighorn Lodge,CO,80447,"Hotels,Lodging,Motels,Hotel,Hotels Motels",Accommodation & Food Services,0.8934,['Good price'],1,"[('good', 0.7071067811865475), ('price', 0.7071067811865475)]",4.0
53,Americas Best Value Inn Clear Lake,IA,50428,"Hotels,Lodging,Motels,Hotel",Accommodation & Food Services,0.7804,"['Never stay there ever. Stay and Service Unacceptable. Never use third party booking.', ' Pretty good hotel for the price']",2,"[('stay', 0.6666666666666667), ('good', 0.5), ('hotel', 0.5), ('pretty', 0.5), ('price', 0.5)]",2.5
54,Americas Best Value Inn Grand Junction,CO,81506,"Hotels,Lodging,Motels,Hotel",Accommodation & Food Services,0.908,['Very clean'],1,"[('clean', 1.0)]",4.0
55,Americas Best Value Inn Jonesville,NC,28642,"Hotels,Lodging,Motels,Hotel",Accommodation & Food Services,0.8649,"['Update - pretty good value for the price.', ' Would stay again']",2,"[('stay', 1.0), ('good', 0.447213595499958), ('pretty', 0.447213595499958), ('price', 0.447213595499958), ('update', 0.447213595499958)]",3.0
56,Americas Best Value Inn Las Vegas,NV,89109,"Hotels,Lodging,Motels,Hotels and motels,Hotel and motel reservations,Hotel",Accommodation & Food Services,-0.8016,['probably the worst motel in Vegas'],1,"[('motel', 0.5), ('probably', 0.5), ('vegas', 0.5), ('worst', 0.5)]",1.0
57,Americas Best Value Inn Mackinaw City,MI,49701,"Hotels,Lodging,Motels,Hotel",Accommodation & Food Services,0.9014,"['Nice restful stay', ' Just an overnight']",2,"[('overnight', 1.0), ('nice', 0.5773502691896257), ('restful', 0.5773502691896257), ('stay', 0.5773502691896257)]",4.5
58,Americas Best Value Inn New Philadelphia,OH,44663,"Hotel,Hotels,Lodging,Motels",Accommodation & Food Services,0.7184,['It served the purpose.'],1,"[('purpose', 0.7071067811865475), ('served', 0.7071067811865475)]",3.0
59,Americas Best Value Inn Pryor,OK,74361,"Hotels,Lodging,Motels,Hotels and motels,Hotel and motel reservations,Hotel",Accommodation & Food Services,0.9812,"['Nice hotel', ' Clean']",2,"[('clean', 1.0), ('hotel', 0.7071067811865476), ('nice', 0.7071067811865476)]",3.5
60,Americas Best Value Inn Suburban Motel,IA,50536,"Hotels,Lodging,Motels,Hotel",Accommodation & Food Services,0.9661,['Old Style Motel with Modern updates'],1,"[('modern', 0.4472135954999579), ('motel', 0.4472135954999579), ('old', 0.4472135954999579), ('style', 0.4472135954999579), ('updates', 0.4472135954999579)]",4.0
61,Americas Best Value Inn Suites,IL,62274,"Hotels,Lodging,Motels,Hotel,Travel & Transport,Hotels & Motels",Accommodation & Food Services,0.8122,['Average place to stay'],1,"[('average', 0.5773502691896258), ('place', 0.5773502691896258), ('stay', 0.5773502691896258)]",3.0
62,Americas Best Value Inn Suites Carrollton,GA,30117,"Hotels,Lodging,Hotel",Accommodation & Food Services,0.9643,"['Clean', ' Utilitarian choice']",2,"[('clean', 1.0), ('choice', 0.7071067811865476), ('utilitarian', 0.7071067811865476)]",3.5
63,Americas Best Value Inn Suites Grand Island,NE,68801,"Hotels,Lodging,Motels,Hotel",Accommodation & Food Services,0.9835,['Good Job Team ABV...'],1,"[('abv', 0.5), ('good', 0.5), ('job', 0.5), ('team', 0.5)]",5.0
64,Americas Best Value Inn Suites-Abilene Mall,TX,79605,"Hotels,Lodging,Motels,Hotel",Accommodation & Food Services,0.9587,"['wonderful', ' There were BEDBUG in my bed.', ' great place to stay', ' hotel stay']",4,"[('stay', 1.1060645605635198), ('wonderful', 1.0), ('hotel', 0.7852882757103967), ('bed', 0.7071067811865476), ('bedbug', 0.7071067811865476)]",4.0
65,Americas Best Value Inn Texarkana,AR,71854,"Hotels,Lodging,Motels,Hotel",Accommodation & Food Services,0.9686,"['Nice Room and Close to lot of things', ' Not worth the price']",2,"[('price', 0.7071067811865476), ('worth', 0.7071067811865476), ('close', 0.447213595499958), ('lot', 0.447213595499958), ('nice', 0.447213595499958)]",3.5
66,Americas Best Value Inn-arkansas City,KS,67005,"Hotels,Hotels and motels,Hotel and motel reservations,Lodging,Motels,Hotel",Accommodation & Food Services,0.9451,['They take the Best Value name seriously'],1,"[('best', 0.5773502691896258), ('seriously', 0.5773502691896258), ('value', 0.5773502691896258)]",4.0
67,Americas Best Value Inn-corpus Christi North/airport,TX,78409,"Hotels,Hotels and motels,Lodging,Motels,Hotel",Accommodation & Food Services,0.9072,"['Needs Improvement', ' Not the greatest.']",2,"[('greatest', 1.0), ('improvement', 0.7071067811865476), ('needs', 0.7071067811865476)]",2.0
68,Americas Best Value Inn-east Syracuse,NY,13057,"Hotels and motels,Hotel and motel reservations,Motels,Hotels,Lodging,Hotel",Accommodation & Food Services,0.9901,"['Reasonable', ' Nice stop at a fair price', ' good over night stay']",3,"[('reasonable', 1.0), ('good', 0.5773502691896257), ('night', 0.5773502691896257), ('stay', 0.5773502691896257), ('fair', 0.5)]",3.67
69,Americas Best Value Inn-north Capital,NC,27604,"Hotels and motels,Hotel and motel reservations,Hotels,Lodging,Motels,Hotel",Accommodation & Food Services,0.7712,['Comfortable for decent price'],1,"[('comfortable', 0.5773502691896258), ('decent', 0.5773502691896258), ('price', 0.5773502691896258)]",3.0
70,Americas Best Value Inn-rialto,CA,92376,"Hotels,Hotels and motels,Hotel and motel reservations,Lodging,Motels,Hotel",Accommodation & Food Services,-0.9592,['Worst Stay Of my life!!'],1,"[('life', 0.5773502691896258), ('stay', 0.5773502691896258), ('worst', 0.5773502691896258)]",1.0
71,Americas Best Value Inn-weatherford,OK,73096,"Hotels and motels,Hotel and motel reservations,Hotels,Lodging,Motels,Hotel",Accommodation & Food Services,0.5411,['The most repulsive place I have ever had to lodge'],1,"[('lodge', 0.5773502691896258), ('place', 0.5773502691896258), ('repulsive', 0.5773502691896258)]",1.0
72,Anglers Inn,ID,83420,"Bed and Breakfast and Inns,Hotels,Lodging,Hotels Motels,Hotel",Accommodation & Food Services,-0.3182,"['These people try, but they miss the mark.']",1,"[('mark', 0.5), ('miss', 0.5), ('people', 0.5), ('try', 0.5)]",2.0
73,Apple Tree Inn,IA,50125,"Hotels,Hotels Motels,Hotels and motels,Hotel",Accommodation & Food Services,0.0,['Convenient to activities. Great breakfast buffet but no pool.'],1,"[('activities', 0.4082482904638631), ('breakfast', 0.4082482904638631), ('buffet', 0.4082482904638631), ('convenient', 0.4082482904638631), ('great', 0.4082482904638631)]",3.0
74,Appletree Inn,KS,67301,"Building,Bed Breakfasts,Hotels,Apartment Hotels,Inns,Lodging,Hotels Motels,Hotels-Apartment,Extended Stay Hotels,Bed & Breakfast & Inns,Motels,Hotel",Accommodation & Food Services,0.2732,['My stay was clean and comfortable.'],1,"[('clean', 0.5773502691896258), ('comfortable', 0.5773502691896258), ('stay', 0.5773502691896258)]",4.0
75,Aqua Beach Inn,SC,29577,"Hotel,Hotels",Accommodation & Food Services,0.9994,"[' 3 great nights at Aqua Blue Inn', ' very nice and clean hotel.', ' Nice little hotel in a fun location.', ' Great hotel']",13,"[('hotel', 1.562271776703256), ('clean', 1.2521447329054292), ('great', 1.1441433596874904), ('nice', 1.0135768068973054), ('satisfied', 1.0)]",4.08
76,Aqua Soleil Hotel And Mineral Water Spa,CA,92240,"Hotels,Hotels Motels,Hotel",Accommodation & Food Services,0.875,['Lavender room!'],1,"[('lavender', 0.7071067811865475), ('room', 0.7071067811865475)]",4.0
77,Aqua Waikiki Pearl,HI,96815,"Hotels and motels,Hotels,Lodging,Resorts,Hotels Motels,Hotel",Accommodation & Food Services,0.9983,"['Best service', ' Great location in heart of Waikiki!', ' Great place', ' Clean ,convenient with a gracious staff.']",5,"[('great', 1.0501559026369511), ('place', 0.7782829228046183), ('best', 0.7071067811865475), ('nice', 0.7071067811865475), ('service', 0.7071067811865475)]",4.2
78,Argosy Casino Hotel Spa,MO,64150,"Casinos,Restaurants,Hotels,Day Spas,Hotel",Accommodation & Food Services,0.9289,"['OK Hotel, Needs maintenance better amenities']",1,"[('amenities', 0.4082482904638631), ('better', 0.4082482904638631), ('hotel', 0.4082482904638631), ('maintenance', 0.4082482904638631), ('needs', 0.4082482904638631)]",3.0
79,Arizona Inn Suites,AZ,85364,"Lodging,Motels,Hotels,Hotels and motels,Hotel,Hotels Motels",Accommodation & Food Services,0.9585,['Nice and clean'],1,"[('clean', 0.7071067811865475), ('nice', 0.7071067811865475)]",5.0
