Unnamed: 0,Hotel Name,Province,Postal,Category,SubCategory,Compound Sentiment,Total Reviews,Average Rating
748,Four Points by Sheraton San Jose - Silicon Valley,CA,95138,"Accommodations & Lodging,  Hotel & Motel reservations,  Resorts,  Lodging,  Hotel & Motel,  Hotel",Accommodation & Food Services,1,4,2
749,Four Seasons Hotel New York Downtown,NY,10007,Hotel,Accommodation & Food Services,1,1,5
750,Frederick Hotel Cafe,NE,68853,"Lodging,  Restaurants,  Restaurant,  Hotel",Accommodation & Food Services,1,1,4
751,Freehand Chicago,IL,60611-2707,Hotel,Accommodation & Food Services,1,1,1
752,Fremont Hotel & Casino,NV,89101,Hotel,Accommodation & Food Services,1,85,4
753,French Quarter Suites Hotel,LA,70116-2434,"Lodging,  Hotel & Motel,  Hotel,  Motel",Accommodation & Food Services,1,7,4
754,Friday Harbor Suites,WA,98250,"Hotel-Apartment,  Resorts,  Lodging,  Motel,  Hotel,  Corporate Lodging",Accommodation & Food Services,1,1,5
755,Fun City Motel,NV,89104,"Motel,  Lodging,  Hotel",Accommodation & Food Services,-0,1,1
756,Galt House Hotel,KY,40202," and Pool Central Business District,  Hotel,  Pool,   Bar,  Hotel & Motel,  Restaurant,  Bar",Accommodation & Food Services,1,22,4
757,Garrison Inn,MA,1950,"Hotel & Motel,  Hotel",Accommodation & Food Services,1,1,3
758,Gateway Inn,CA,96080,"Lodging,  Hotel & Motel,  Hotel,  Motel",Accommodation & Food Services,-1,1,1
759,Gateway Lodge,PA,16217,"Hotel & Motel,  Hotel,  Hotel & Motel reservations,  Resorts",Accommodation & Food Services,1,5,5
760,Git's Big Sky Motel,MT,59019,"Motel,  Lodging,  Hotel",Accommodation & Food Services,1,1,3
761,Golden North Motel,AK,99709,"Hotel & Motel reservations,  Lodging,  Motel,  Hotel & Motel,  Hotel",Accommodation & Food Services,1,1,3
762,Golden West Motel,OR,97603,"Hotel & Motel Consultants,  Lodging,  Motel,  Hotel & Motel,  Hotel",Accommodation & Food Services,1,2,5
763,Governor's Inn,FL,32301,"Hotel & Motel,  Hotel",Accommodation & Food Services,1,5,4
764,Granby Motel,MA,1033,"Motel,  Hotel & Motel,  Lodging,  Hotel",Accommodation & Food Services,0,1,1
765,Grand Coulee Center Lodge,WA,99133,"Motel,  Lodging,  Hotel",Accommodation & Food Services,1,3,4
766,Grand Hyatt Kauai Resort & Spa,HI,96756,"Tourist Hotel,  Ceremony & Reception Venue,  Budget Hotel,  Beach Hotel,  Business Hotel,  Spa Resorts,  Family-friendly Hotel,  Resorts,  Luxury Hotel,  Lodging,  Hotel & Motel,  Restaurant,  Hotel",Accommodation & Food Services,1,27,4
767,Grand Hyatt Tampa Bay,FL,33607,"Tourist Hotel,  Budget Hotel,  Restaurants,  Business Hotel,  Family-friendly Hotel,  Lodging,  Hotel & Motel,  Hotel,  Weekend Getaway Hotel",Accommodation & Food Services,1,11,5
768,Grand Imperial Hotel,CO,81433,"Restaurants,  Motel,  Lodging,  Hotel & Motel,  Hotel",Accommodation & Food Services,1,6,4
769,Grand Inn,CA,92832,"Hotel & Motel reservations,  Bed & Breakfast & Inns,  Lodging,  Motel,  Hotel & Motel,  Hotel",Accommodation & Food Services,1,2,4
770,Grand Prix Motel,FL,32118,"Motel,  Hotel & Motel,  Hotel,  Lodging",Accommodation & Food Services,1,3,5
771,Grande Colonial La Jolla,CA,92037-4198,"Luxury Hotel,  Hotel & Motel,  Hotel",Accommodation & Food Services,1,4,5
772,Grant House Hotel Eatery,MN,55069,"Restaurants,  Lodging,  Motel,  Restaurant,  Hotel",Accommodation & Food Services,1,1,5
773,Great View Motel,NY,12937,"Hotel & Motel,  Motel,  Lodging,  Hotel",Accommodation & Food Services,1,2,2
774,Grey Gables Mansion,VT,5476,"Hotel,  Bed and Breakfast and Inns",Accommodation & Food Services,1,1,5
775,Greybull Motel,WY,82426,"Hotel & Motel,  Motel,  Lodging,  Hotel",Accommodation & Food Services,1,3,4
776,Guerneville Lodge,CA,95446,"Hotel & Motel,  Hotel,  Hotel & Motel reservations,  Bed Breakfast",Accommodation & Food Services,0,1,4
777,Halcyon Hotel,CA,94102,"Motel,  Hotel Lower Nob Hill,  Hotel",Accommodation & Food Services,1,1,1
778,Hampton Baltimore/White Marsh,MD,21236,Hotel,Accommodation & Food Services,1,4,4
779,Hampton Inn & Suites Altoona-des Moines,IA,50009,"Lodging,  Hotel & Motel,  Hotel,  Corporate Lodging",Accommodation & Food Services,1,1,5
780,Hampton Inn & Suites Bend,OR,97702,"Lodging,  Hotel & Motel,  Hotel,  Corporate Lodging",Accommodation & Food Services,1,3,5
781,Hampton Inn & Suites Big Spring,TX,79720,"Hotel & Motel,  Hotel",Accommodation & Food Services,1,1,5
782,Hampton Inn & Suites Bradenton Downtown Historic District,FL,34205,"Lodging,  Hotel & Motel,  Hotel,  Corporate Lodging",Accommodation & Food Services,1,1,5
783,Hampton Inn & Suites Brookings,SD,57006,"Lodging,  Hotel & Motel,  Hotel,  Corporate Lodging",Accommodation & Food Services,1,1,5
784,Hampton Inn & Suites Camarillo,CA,93010,"Hotel & Motel,  Hotel",Accommodation & Food Services,1,24,4
785,Hampton Inn & Suites Cedar Rapids North,IA,52402,"Lodging,  Hotel & Motel,  Hotel,  Corporate Lodging",Accommodation & Food Services,1,1,5
786,"Hampton Inn & Suites Chapel Hill/Durham, Area",NC,27517,"Hotel & Motel consultants,  Lodging,  Hotel & Motel,  Hotel,  Corporate Lodging",Accommodation & Food Services,1,10,5
787,Hampton Inn & Suites Coeur d'Alene,ID,83814-5760,"Lodging,  Hotel & Motel,  Hotel,  Corporate Lodging",Accommodation & Food Services,1,1,5
788,Hampton Inn & Suites Dallas/Cockrell Hill I-30,TX,75211-1313,"Lodging,  Hotel & Motel,  Hotel,  Corporate Lodging",Accommodation & Food Services,1,4,4
789,Hampton Inn & Suites Denver Ap Gateway Park,CO,80239,"Lodging,  Hotel,  Corporate Lodging",Accommodation & Food Services,1,8,5
790,Hampton Inn & Suites Denver Tech Center,CO,80237,"Safety consultants,  Lodging,  Hotel Bar,  Hotel & Motel,  Hotel,  Corporate Lodging",Accommodation & Food Services,1,13,4
791,Hampton Inn & Suites Dickinson,ND,58601,"Lodging,  Hotel & Motel,  Hotel,  Corporate Lodging",Accommodation & Food Services,1,1,5
792,Hampton Inn & Suites Dodge City,KS,67801,"Lodging,  Hotel & Motel,  Hotel,  Corporate Lodging",Accommodation & Food Services,1,6,5
793,Hampton Inn & Suites Dupont,WA,98327,"Lodging,  Hotel,  Corporate Lodging",Accommodation & Food Services,1,8,5
794,Hampton Inn & Suites Fremont,OH,43420,"Lodging,  Hotel & Motel,  Hotel,  Corporate Lodging",Accommodation & Food Services,1,3,4
795,Hampton Inn & Suites Grand Rapids Downtown,MI,49503,"Lodging,  Hotel & Motel,  Hotel,  Corporate Lodging",Accommodation & Food Services,1,1,5
796,Hampton Inn & Suites Indianapolis/brownsburg,IN,46112,"Lodging,  Hotel & Motel,  Hotel,  Corporate Lodging",Accommodation & Food Services,1,4,4
797,Hampton Inn & Suites Jackson,TN,38305,"Lodging,  Hotel,  Corporate Lodging",Accommodation & Food Services,1,8,4
798,Hampton Inn & Suites Little Rock-downtown,AR,72201,"Lodging,  Hotel & Motel,  Hotel,  Corporate Lodging",Accommodation & Food Services,1,5,4
799,Hampton Inn & Suites New Albany Columbus,OH,43054,"Lodging,  Hotel & Motel,  Hotel,  Corporate Lodging",Accommodation & Food Services,1,1,5
800,Hampton Inn & Suites Newport/Middletown,RI,02842-7326,"Restaurants,  Hotel & Motel,  Hotel",Accommodation & Food Services,1,5,5
801,Hampton Inn & Suites Palestine,TX,75801-6934,"Lodging,  Hotel,  Corporate Lodging",Accommodation & Food Services,1,6,5
802,Hampton Inn & Suites Philadelphia Montgomeryville,PA,19454,"Hotel & Motel reservations,  Lodging,  Hotel & Motel,  Hotel,  Corporate Lodging",Accommodation & Food Services,1,3,5
803,Hampton Inn & Suites Rochester/Victor,NY,14564,Hotel,Accommodation & Food Services,1,4,5
804,Hampton Inn & Suites Rosemont Chicago O'hare,IL,60018,"Lodging,  Hotel & Motel,  Hotel,  Corporate Lodging",Accommodation & Food Services,1,1,5
805,Hampton Inn & Suites Salisbury Fruitland,MD,21826,"Lodging,  Hotel,  Corporate Lodging",Accommodation & Food Services,1,3,5
806,Hampton Inn & Suites Seattle/federal Way,WA,98003,"Travel and Tourism,  Hotel & Motel,  Hotel",Accommodation & Food Services,1,5,5
807,Hampton Inn & Suites Springfield/Downtown,MA,1105,"Travel agencies and bureaus,  Hotel & Motel reservations,  Lodging,  Hotel & Motel,  Hotel,  Corporate Lodging",Accommodation & Food Services,1,4,5
808,Hampton Inn & Suites St Louis at Forest Park,MO,63110,Hotel,Accommodation & Food Services,1,10,5
809,Hampton Inn & Suites St. Louis/South I-55,MO,63129-1202,"Lodging,  Hotel & Motel,  Hotel,  Corporate Lodging",Accommodation & Food Services,1,2,5
810,Hampton Inn & Suites Tampa Northwest/oldsmar,FL,34677,"Lodging,  Hotel & Motel,  Hotel,  Corporate Lodging",Accommodation & Food Services,1,5,5
811,Hampton Inn & Suites Tulsa South-bixby,OK,74133,"Hotel and Hotel Pool,  Lodging,  Hotel & Motel,  Hotel Pool,  Hotel,  Corporate Lodging",Accommodation & Food Services,1,5,4
812,Hampton Inn & Suites Wilmington Christiana,DE,19713,"Lodging,  Hotel & Motel,  Hotel,  Corporate Lodging",Accommodation & Food Services,1,5,5
813,Hampton Inn & Suites Woodstock Va,VA,22664,"Hotel & Motel,  Hotel",Accommodation & Food Services,1,2,5
814,Hampton Inn Ashtabula,OH,44010,"Hotel & Motel,  Hotel",Accommodation & Food Services,1,1,4
815,Hampton Inn Atlanta-Mall Of Georgia,GA,30519,"Lodging,  Hotel & Motel,  Hotel,  Corporate Lodging",Accommodation & Food Services,-1,1,4
816,Hampton Inn Atlanta-Perimeter Center,GA,30328-6118,"Hotel,  Convention Services and Facilities",Accommodation & Food Services,1,7,4
817,Hampton Inn Atlanta-cumberland Mall/nw,GA,30339,"Lodging,  Hotel & Motel,  Hotel,  Corporate Lodging",Accommodation & Food Services,1,7,4
818,Hampton Inn Augusta/Gordon Highway,GA,30909,"Lodging,  Hotel,  Corporate Lodging",Accommodation & Food Services,1,2,5
819,Hampton Inn Baltimore/white Marsh,MD,21236,"Lodging,  Hotel & Motel,  Hotel,  Corporate Lodging",Accommodation & Food Services,1,1,5
820,Hampton Inn Bedford,PA,15522,"Lodging,  Hotel & Motel,  Hotel,  Corporate Lodging",Accommodation & Food Services,1,2,4
821,Hampton Inn Bowling Green,KY,42104,"Hotel & Motel reservations,  Lodging,  Hotel & Motel,  Hotel,  Corporate Lodging",Accommodation & Food Services,1,11,4
822,Hampton Inn Bremen-I-20 (Carrollton Area),GA,30110,"Lodging,  Hotel,  Corporate Lodging",Accommodation & Food Services,-0,1,2
823,Hampton Inn Brentwood,CA,94513,"Hotel & Motel,  Corporate housing,  Hotel",Accommodation & Food Services,1,4,4
824,Hampton Inn Carrollton,KY,41008,"Lodging,  Hotel,  Corporate Lodging",Accommodation & Food Services,0,1,3
825,Hampton Inn Champaign Urbana,IL,61801,"Lodging,  Hotel & Motel,  Hotel,  Corporate Lodging",Accommodation & Food Services,1,2,5
826,Hampton Inn Chicago Downtown/N Loop/Michigan Ave,IL,60601,"Hotel The Loop,  Hotel",Accommodation & Food Services,1,7,4
827,Hampton Inn Columbus/South-Fort Benning,GA,31903,"Hotel & Motel,  Hotel",Accommodation & Food Services,1,10,5
828,Hampton Inn Concord/Bow,NH,3304,"Tourist Hotel,  Budget Hotel,  Family-Friendly Hotel,  Business Hotel,  Lodging,  Hotel & Motel,  Hotel,  Corporate Lodging",Accommodation & Food Services,1,6,5
829,Hampton Inn Easton,MD,21601,"Lodging,  Hotel,  Corporate Lodging",Accommodation & Food Services,1,1,5
830,Hampton Inn Elkins,WV,26241,"Lodging,  Hotel & Motel,  Hotel,  Corporate Lodging",Accommodation & Food Services,1,4,4
831,Hampton Inn Erie-South,PA,16509,"Lodging,  Hotel & Motel,  Hotel,  Corporate Lodging",Accommodation & Food Services,1,12,4
832,Hampton Inn Galax,VA,24333,"Lodging,  Hotel & Motel,  Hotel,  Corporate Lodging",Accommodation & Food Services,1,1,5
833,Hampton Inn Gloucester,VA,23061,"Lodging,  Hotel,  Corporate Lodging",Accommodation & Food Services,1,20,4
834,Hampton Inn Greenville/simpsonville,SC,29680,"Lodging,  Hotel & Motel,  Hotel,  Corporate Lodging",Accommodation & Food Services,1,3,4
835,Hampton Inn Hampton-Newport News,VA,23666,"Lodging,  Hotel & Motel,  Hotel,  Corporate Lodging,  News dealers",Accommodation & Food Services,1,12,5
836,Hampton Inn Hilton Head,SC,29926,"Lodging,  Hotel & Motel,  Hotel,  Corporate Lodging",Accommodation & Food Services,1,8,4
837,Hampton Inn Horse Cave,KY,42749,"Lodging,  Hotel,  Corporate Lodging",Accommodation & Food Services,1,7,4
838,Hampton Inn Houston Deer Park Ship Area,TX,77536,"Lodging,  Hotel & Motel,  Hotel,  Corporate Lodging",Accommodation & Food Services,-1,3,3
839,Hampton Inn Indianapolis/carmel,IN,46032,"Hotel & Motel,  Hotel",Accommodation & Food Services,1,14,4
840,Hampton Inn Indianola,MS,38751,"Lodging,  Hotel,  Corporate Lodging",Accommodation & Food Services,1,1,5
841,Hampton Inn Kingsland,GA,31548,"Hotel & Motel,  Hotel,  Hotel & Motel reservations",Accommodation & Food Services,1,6,4
842,Hampton Inn Knoxville/Clinton I-75,TN,37716,"Lodging,  Hotel,  Corporate Lodging",Accommodation & Food Services,1,1,5
843,Hampton Inn Lacrosse/Onalaska,WI,54650,"Lodging,  Hotel,  Corporate Lodging",Accommodation & Food Services,1,3,4
844,Hampton Inn Lafayette,IN,47905,"Lodging,  Hotel,  Corporate Lodging",Accommodation & Food Services,1,4,5
845,Hampton Inn Las Vegas North Speedway,NV,89030,"Lodging,  Hotel,  Corporate Lodging",Accommodation & Food Services,1,3,5
846,Hampton Inn Lebanon,KY,40033,"Lodging,  Hotel & Motel,  Hotel,  Corporate Lodging",Accommodation & Food Services,1,2,5
847,Hampton Inn Lexington Medical Center,KY,40503,"Lodging,  Hotel,  Corporate Lodging",Accommodation & Food Services,1,1,5
848,Hampton Inn Macomb,IL,61455,"Lodging,  Hotel,  Corporate Lodging,  Hotel and Hotel Pool",Accommodation & Food Services,1,2,4
849,Hampton Inn Memphis/Southaven,MS,38671,"Lodging,  Hotel,  Corporate Lodging",Accommodation & Food Services,1,4,4
850,Hampton Inn Middletown,NY,10941,"Lodging,  Hotel,  Corporate Lodging",Accommodation & Food Services,1,6,4
851,Hampton Inn Myrtle Beach-Northwood,SC,29572,"Tourist Hotel,  Family-Friendly Hotel,  Business Hotel,  Beach Hotel,  Golf Resorts,  Resorts,  Lodging,  Luxury Hotel,  Hotel & Motel,  Hotel,  Corporate Lodging,  Weekend Getaway Hotel",Accommodation & Food Services,1,1,3
852,Hampton Inn New Bedford/Fairhaven,MA,2719,"Lodging,  Hotel & Motel,  Hotel,  Corporate Lodging",Accommodation & Food Services,1,2,4
853,Hampton Inn Newark-Airport,NJ,7201,"Lodging,  Hotel & Motel,  Hotel,  Corporate Lodging",Accommodation & Food Services,1,7,3
854,Hampton Inn Newport News-Yorktown,VA,23602,"Lodging,  Hotel,  Corporate Lodging",Accommodation & Food Services,1,8,4
855,Hampton Inn Norfolk/Virginia Beach,VA,23462,"Lodging,  Hotel & Motel,  Hotel,  Corporate Lodging",Accommodation & Food Services,1,19,4
856,Hampton Inn Odessa,TX,79762,"Lodging,  Hotel,  Corporate Lodging",Accommodation & Food Services,1,1,5
857,Hampton Inn Omaha Midtown-Aksarben Area,NE,68124,"Lodging,  Hotel,  Corporate Lodging",Accommodation & Food Services,1,2,4
858,Hampton Inn Orange City,IA,51041,"Lodging,  Hotel,  Corporate Lodging",Accommodation & Food Services,1,1,5
859,Hampton Inn Orlando-Maingate South,FL,33897,"Hotel & Motel,  Hotel",Accommodation & Food Services,1,2,4
860,Hampton Inn Oxford,ME,4270,"Lodging,  Hotel,  Corporate Lodging",Accommodation & Food Services,1,1,5
861,Hampton Inn Oxford-West,MS,38655,"Lodging,  Hotel,  Corporate Lodging",Accommodation & Food Services,1,5,5
862,Hampton Inn Potomac Mills/Woodbridge,VA,22191,"Hotel & Motel Reservations,  Accommodation Reservations,  Accommodations & Lodging,  Hotel Representatives,  Hotel & Motel,  Hotel Woodbridge,  Hotel",Accommodation & Food Services,1,5,4
863,Hampton Inn Roanoke/Hollins - I-81,VA,24019,"Lodging,  Hotel,  Corporate Lodging",Accommodation & Food Services,1,1,4
864,Hampton Inn Springfield,OH,45505,"Lodging,  Hotel,  Corporate Lodging",Accommodation & Food Services,1,5,5
865,Hampton Inn Springfield South,MO,65804,"Hotel & Motel,  Hotel",Accommodation & Food Services,1,1,5
866,Hampton Inn Suites Ardmore,OK,73401,"Lodging,  Hotel,  Corporate Lodging",Accommodation & Food Services,1,1,5
867,Hampton Inn Suites Blythe,CA,92225,"Hotel & Motel reservations,  Lodging,  Hotel & Motel,  Hotel,  Corporate Lodging",Accommodation & Food Services,1,2,4
868,Hampton Inn Suites California University-Pittsburgh,PA,15423,"Lodging,  Hotel,  Corporate Lodging",Accommodation & Food Services,1,4,4
869,Hampton Inn Suites Camp Springs/Andrews AFB,MD,20746,"Lodging,  Hotel & Motel,  Hotel,  Corporate Lodging",Accommodation & Food Services,0,1,4
870,Hampton Inn Suites Cincinnati/Uptown-University Area,OH,45219,"Lodging,  Hotel & Motel,  Hotel,  Corporate Lodging",Accommodation & Food Services,1,1,4
871,Hampton Inn Suites Columbia/South,MD,21046,"Lodging,  Hotel,  Corporate Lodging",Accommodation & Food Services,1,17,4
872,Hampton Inn Suites Columbus/University Area,OH,43202,"Lodging,  Hotel,  Corporate Lodging",Accommodation & Food Services,1,1,5
873,Hampton Inn Suites Conroe I45 North,TX,77303,"Hotel,  Lodging,  Hotel & Motel,  Gym,  Corporate Lodging",Accommodation & Food Services,1,2,3
874,Hampton Inn Suites Dallas-Arlington North-Entertainment District,TX,76006,"Lodging,  Hotel & Motel,  Hotel,  Corporate Lodging",Accommodation & Food Services,1,3,4
875,Hampton Inn Suites Deland,FL,32720,"Lodging,  Hotel & Motel,  Hotel,  Corporate Lodging",Accommodation & Food Services,1,3,5
876,Hampton Inn Suites Detroit-Canton,MI,48187,"Lodging,  Hotel & Motel,  Hotel,  Corporate Lodging",Accommodation & Food Services,1,2,4
877,Hampton Inn Suites Fort Myers-Colonial Blvd.,FL,33916,"Tourist Hotel,  Budget Hotel,  Business Hotel,  Family-friendly Hotel,  Resort,  Motel,  Lodging,  Hotel & Motel,  Hotel,  Corporate Lodging",Accommodation & Food Services,1,16,5
878,Hampton Inn Suites Greenville/Spartanburg I-85,SC,29334,"Hotel & Motel reservations,  Spa,  Lodging,  Hotel & Motel,  Bed and Breakfast and Inns,  Hotel,  Corporate Lodging",Accommodation & Food Services,1,3,5
879,Hampton Inn Suites Hudson,WI,54016,"Lodging,  Hotel,  Corporate Lodging",Accommodation & Food Services,1,3,5
880,Hampton Inn Suites Indianapolis-Keystone,IN,46240,"Lodging,  Hotel,  Corporate Lodging",Accommodation & Food Services,1,1,5
881,Hampton Inn Suites Kansas City-Country Club Plaza,MO,64112,"Lodging,  Hotel,  Corporate Lodging",Accommodation & Food Services,1,6,4
882,Hampton Inn Suites Knoxville Papermill Drive,TN,37919,"Lodging,  Hotel & Motel,  Hotel,  Corporate Lodging",Accommodation & Food Services,1,2,5
883,Hampton Inn Suites Lake Mary At Colonial Townpark,FL,32746,"Lodging,  Hotel & Motel,  Hotel,  Corporate Lodging",Accommodation & Food Services,1,6,4
884,Hampton Inn Suites Lansing West,MI,48917,"Lodging,  Hotel,  Corporate Lodging",Accommodation & Food Services,1,1,4
885,Hampton Inn Suites Lavonia,GA,30553,"Hotel & Motel reservations,  Lodging,  Hotel & Motel,  Hotel,  Corporate Lodging",Accommodation & Food Services,1,1,5
886,Hampton Inn Suites Leesburg,VA,20176,"Lodging,  Hotel,  Corporate Lodging",Accommodation & Food Services,1,3,4
887,Hampton Inn Suites Lynchburg,VA,24502,"Lodging,  Hotel,  Corporate Lodging",Accommodation & Food Services,1,3,5
888,Hampton Inn Suites McAlester,OK,74501,"Lodging,  Hotel,  Corporate Lodging",Accommodation & Food Services,1,1,5
889,Hampton Inn Suites Minneapolis/Downtown,MN,55403,"Lodging,  Hotel & Motel,  Hotel,  Corporate Lodging",Accommodation & Food Services,1,6,5
890,Hampton Inn Suites Minooka,IL,60447,"Lodging,  Hotel,  Corporate Lodging",Accommodation & Food Services,1,1,5
891,Hampton Inn Suites Monroe,LA,71202,"Lodging,  Hotel & Motel,  Hotel,  Corporate Lodging",Accommodation & Food Services,1,1,5
892,Hampton Inn Suites National HarborAlexandria Area,MD,20745,"Lodging,  Hotel,  Corporate Lodging",Accommodation & Food Services,1,31,5
893,Hampton Inn Suites Oklahoma City Airport,OK,73108,"Lodging,  Hotel & Motel,  Hotel,  Corporate Lodging",Accommodation & Food Services,1,4,4
894,Hampton Inn Suites Orangeburg,SC,29118,"Lodging,  Hotel,  Corporate Lodging",Accommodation & Food Services,1,3,5
895,Hampton Inn Suites Pigeon Forge On The Parkway,TN,37863,"Lodging,  Hotel & Motel,  Hotel,  Corporate Lodging",Accommodation & Food Services,1,5,4
896,Hampton Inn Suites PortlandVancouver,WA,98684,"Hotel & Motel reservations,  Real estate,  Lodging,  Hotel & Motel,  Hotel,  Corporate Lodging",Accommodation & Food Services,1,6,5
897,Hampton Inn Suites Richmond,IN,47374,"Lodging,  Hotel,  Corporate Lodging",Accommodation & Food Services,1,1,5
898,Hampton Inn Suites San Antonio-Downtown/Market Square,TX,78204,Hotel,Accommodation & Food Services,1,1,5
899,Hampton Inn Suites Sioux City/South,IA,51106,"Lodging,  Hotel,  Corporate Lodging",Accommodation & Food Services,1,1,5
900,Hampton Inn Suites Springdale,AR,72762,"Lodging,  Hotel,  Corporate Lodging",Accommodation & Food Services,1,1,5
901,Hampton Inn Suites West Des Moines/SW Mall Area,IA,50266,"Lodging,  Hotel,  Corporate Lodging",Accommodation & Food Services,1,1,5
902,Hampton Inn Sulphur/Lake Charles Area,LA,70663,"Lodging,  Hotel & Motel,  Hotel,  Corporate Lodging",Accommodation & Food Services,1,2,5
903,Hampton Inn Texarkana Arkansas,AR,71854,"Lodging,  Hotel,  Corporate Lodging",Accommodation & Food Services,1,1,5
904,Hampton Inn Tomah,WI,54660,"Lodging,  Hotel & Motel,  Hotel,  Corporate Lodging",Accommodation & Food Services,1,2,4
905,Hampton Inn Union City,CA,94587,"Hotel & Motel,  Hotel,  Hotel & Motel reservations,  accommodations & lodging",Accommodation & Food Services,1,5,5
906,Hampton Inn Waynesboro/Stuarts Draft,VA,22939,"Lodging,  Hotel,  Corporate Lodging",Accommodation & Food Services,1,2,4
907,Hampton Inn West Palm Beach Central Airport,FL,33409,"Hotel & Motel,  Hotel",Accommodation & Food Services,1,6,5
908,Hampton Inn and Suites Baltimore Inner Harbor,MD,21202,"Hotel & Motel,  Hotel",Accommodation & Food Services,1,39,4
909,Hampton Inn and Suites Napa,CA,94559-4191,"Hotel & Motel,  Hotel",Accommodation & Food Services,1,25,4
910,Hampton Inn and Suites Williamsburg-Central,VA,23185,"Hotel & Motel,  Hotel",Accommodation & Food Services,-1,22,4
911,Hampton Inn-athens,GA,30606,"Lodging,  Hotel & Motel,  Hotel,  Corporate Lodging",Accommodation & Food Services,1,5,4
912,Hampton Inn-elkhorn,WI,53121,"Hotel and Gym / Fitness Center,  Bed & Breakfast & Inns,  Lodging,  Hotel & Motel,  Hotel,  Corporate Lodging",Arts Entertainment & Recreation,1,6,4
913,Hampton Inn-elmira/horseheads,NY,14845,"Lodging,  Hotel & Motel,  Hotel,  Corporate Lodging",Accommodation & Food Services,1,7,4
914,Hampton Inn-fairfax City,VA,22030,"Hotel & Motel,  Hotel",Accommodation & Food Services,1,4,4
915,Hampton Inn-janesville,WI,53546,"Lodging,  Hotel & Motel,  Hotel,  Corporate Lodging",Accommodation & Food Services,1,4,5
916,Hampton Inn-lincolnton,NC,28092,"Hotel & Motel,  Hotel",Accommodation & Food Services,1,1,5
917,Hampton Inn-saco/biddeford,ME,4072,"Hotel & Motel reservations,  Lodging,  Hotel & Motel,  Hotel,  Corporate Lodging",Accommodation & Food Services,1,4,4
918,Hampton Inn-seattle/everett,WA,98201,"Lodging,  Hotel & Motel,  Hotel,  Corporate Lodging",Accommodation & Food Services,1,2,4
919,Hampton San Diego-Kearny Mesa,CA,92111,"Hotel,  Gym / Fitness Center",Arts Entertainment & Recreation,1,2,4
920,Hangar Hotel,TX,78624,"Lodging,  Hotel & Motel,  Hotel,  Motel",Accommodation & Food Services,1,1,5
921,Harbor Resort,WA,98595,Hotel,Accommodation & Food Services,1,2,4
922,Harborside Inn,MA,2109,"Tourist Hotel,  Budget Hotel,  Bed & Breakfast & Inns,  Lodging,  Motel,  Hotel & Motel,  Hotel",Accommodation & Food Services,1,8,5
923,Harborside Inn,MA,2539,"Time Shares,  Hotel & Motel,  Hotel",Accommodation & Food Services,1,1,4
924,Harbourfront Motel,MI,48450,"Hotel & Motel,  Motel,  Lodging,  Hotel",Accommodation & Food Services,1,1,4
925,Harrison Street Inn,OR,97110,"Motel,  Hotel,  B&bs / Inns",Accommodation & Food Services,1,1,3
926,Hartsville Motel,SC,29550,"Motel,  Lodging,  Hotel & Motel,  Hotel,  Corporate Lodging",Accommodation & Food Services,0,1,2
927,Hat City Tavern,CT,6810,"American Restaurant,  Beer Garden,  Hotel Bar,  Event Space,  Hotel",Accommodation & Food Services,1,3,5
928,Hawthorn Suites By Wyndham Dayton North,OH,45414,"Extended Stay,  Hotel & Motel reservations,  Tourist Hotel,  Budget Hotel,  Apartment Hotel,  Business Hotel,  Family-friendly Hotel,  Hotel & Motel,  Hotel,  Weekend Getaway Hotel",Accommodation & Food Services,1,7,3
929,Hawthorn Suites By Wyndham Oshkosh,WI,54904,"Extended Stay,  Tourist Hotel,  Family-Friendly Hotel,  Apartment Hotel,  Business Hotel,  Hotel & Motel,  Hotel,  Weekend Getaway Hotel",Accommodation & Food Services,1,2,4
930,Hawthorn Suites By Wyndham Tyler,TX,75701,"Hotel & Motel reservations,  Tourist Hotel,  Budget Hotel,  Family-Friendly Hotel,  Travel,  Lodging,  Luxury Hotel,  Hotel & Motel,  Boutique Hotel,  Hotel",Accommodation & Food Services,0,1,3
931,Hearthside Village Cottage Motel,NH,3574,"Lodging,  Hotel",Accommodation & Food Services,1,1,5
932,Heidelberg Lodges,TX,78130,"Recreation Centers,  Hotel-Apartment,  Resorts & Vacation Cottages,  Apartment Hotel,  Resorts,  Lodging,  Motel,  Hotel & Motel,  Hotel",Accommodation & Food Services,1,2,4
933,Hemlock Hall,NY,12812,"Lake Management,  Hotel,  Resorts",Accommodation & Food Services,1,1,5
934,Heritage Court Motel,WI,54771,"Lodging,  Hotel & Motel,  Hotel,  Motel",Accommodation & Food Services,-1,1,1
935,Heritage Inn,AR,72149,"Travel and Tourism,  Motel,  Lodging,  Hotel & Motel,  Hotel",Accommodation & Food Services,1,1,4
936,Heritage Suites,PA,16701,"Hotel & Motel mgmt.,  Hotel & Motel,  Hotel,  Lodging",Accommodation & Food Services,1,1,4
937,High Point World Resort,FL,34747,"Hotel & Motel,  Hotel,  Resorts",Accommodation & Food Services,-1,4,4
938,Hilltop Motel,MN,56649,"Hotel & Motel,  Motel,  Lodging,  Hotel",Accommodation & Food Services,1,1,4
939,Hilltop Motel,WY,82701,"Hotel & Motel,  Motel,  Lodging,  Hotel",Accommodation & Food Services,1,1,4
940,Hilton Baltimore BWI Airport,MD,21090,"Meeting Room,  Hotel",Accommodation & Food Services,1,33,4
941,Hilton Cleveland Downtown,OH,44114,"Lodging,  Hotel Downtown Cleveland,  Hotel",Accommodation & Food Services,1,1,5
